title,description,category,popularity_score,image_url,tags,ai_confidence
Y2K Revival,"Early 2000s fashion is making a major comeback with low-rise jeans, metallic fabrics, and chunky sneakers dominating the scene.",Retro,92,https://images.pexels.com/photos/1040945/pexels-photo-1040945.jpeg,"Y2K,Retro,Low-rise,Metallic,Chunky sneakers",0.94
Sustainable Fashion,"Eco-conscious fashion choices are trending with organic materials, upcycled clothing, and ethical brand partnerships leading the way.",Sustainable,88,https://images.pexels.com/photos/1375849/pexels-photo-1375849.jpeg,"Sustainable,Eco-friendly,Organic,Upcycled,Ethical",0.91
Maximalist Prints,"Bold, vibrant patterns are taking over with animal prints, geometric designs, and color-blocking creating statement looks.",Prints,85,https://images.pexels.com/photos/1043474/pexels-photo-1043474.jpeg,"Maximalist,Prints,Animal print,Geometric,Color-blocking",0.87
Gender-Neutral Fashion,"Breaking traditional boundaries with unisex designs, neutral colors, and inclusive sizing for all body types.",Inclusive,79,https://images.pexels.com/photos/1065084/pexels-photo-1065084.jpeg,"Gender-neutral,Unisex,Inclusive,Neutral colors,Diverse sizing",0.83
Tech-Wear Integration,"Fashion meets technology with smart fabrics, wearable devices, and futuristic designs leading the innovation.",Tech,76,https://images.pexels.com/photos/1040945/pexels-photo-1040945.jpeg,"Tech-wear,Smart fabrics,Wearable tech,Futuristic,Innovation",0.89
Cottagecore Aesthetic,"Romantic, rural-inspired fashion with flowing dresses, floral prints, and vintage-style accessories.",Aesthetic,73,https://images.pexels.com/photos/1375849/pexels-photo-1375849.jpeg,"Cottagecore,Romantic,Floral,Vintage,Rural-inspired",0.85
Minimalist Wardrobe,"Less is more approach with capsule wardrobes, neutral tones, and versatile pieces that mix and match effortlessly.",Minimalist,71,https://images.pexels.com/photos/1043474/pexels-photo-1043474.jpeg,"Minimalist,Capsule wardrobe,Neutral tones,Versatile,Mix and match",0.82
Vintage Denim,"Classic denim styles from the 70s and 80s are resurging with high-waisted jeans, denim jackets, and vintage washes.",Retro,68,https://images.pexels.com/photos/1065084/pexels-photo-1065084.jpeg,"Vintage denim,70s,80s,High-waisted,Denim jackets",0.78
Athleisure Evolution,"Athletic wear continues to evolve with luxury sportswear, performance fabrics, and seamless day-to-night transitions.",Sporty,65,https://images.pexels.com/photos/1040945/pexels-photo-1040945.jpeg,"Athleisure,Luxury sportswear,Performance fabrics,Day-to-night,Athletic wear",0.86